{
  "$schema": "https://json-schema.org/draft/2020-12/schema",
  "$id": "https://example.com/backrest.schema.json",
  "title": "backrest config",
  "description": "Configuration for the backrest unified backup runner.",
  "type": "object",
  "additionalProperties": false,
  "required": ["profiles"],
  "properties": {
    "$schema": {
      "type": "string",
      "description": "Path to the JSON Schema used for validation/autocomplete. Do not remove."
    },
    "log_dir": {
      "type": "string",
      "minLength": 1,
      "description": "Directory where backup run logs are written. Supports $HOME and environment variables."
    },
    "log_retention_days": {
      "type": "integer",
      "minimum": 1,
      "description": "Delete backup-*.log files older than this many days."
    },
    "paths": {
      "type": "object",
      "description": "Named path placeholders. Values are substituted for ${name} references anywhere in the config (e.g. \"storage\": \"/mnt/hdd\" makes ${storage}/restic/x valid).",
      "additionalProperties": { "type": "string", "minLength": 1 }
    },
    "global": {
      "type": "object",
      "description": "Settings shared by all profiles.",
      "additionalProperties": false,
      "properties": {
        "restic_password_file": {
          "type": "string",
          "minLength": 1,
          "description": "Path to a file containing the restic repository password."
        },
        "restic_password_command": {
          "type": "string",
          "minLength": 1,
          "description": "Command that prints the restic password to stdout. Alternative to restic_password_file."
        },
        "restic_password_autogen": {
          "type": "boolean",
          "description": "When true and no password_file/command is set, generate a random restic password on first run and save it to ~/.config/backrest/restic-password. Reused on subsequent runs."
        },
        "restic_compression": {
          "type": "string",
          "description": "restic --compression value (e.g. auto, max, off)."
        },
        "env_file": {
          "type": "string",
          "minLength": 1,
          "description": "Default env file with KEY=VALUE lines loaded for every profile (e.g. AWS_ACCESS_KEY_ID/AWS_SECRET_ACCESS_KEY/AWS_DEFAULT_REGION for an S3 or Backblaze B2 repository). A profile-level env_file overrides it. Supports ${path} placeholders and a leading ~; relative paths are resolved against the config file's directory."
        },
        "check": {
          "enum": ["full", "quick", "never"],
          "description": "Default integrity check mode for restic profiles.\n- full: restic check --read-data (reads whole repo, slow)\n- quick: restic check (metadata only, fast)\n- never: skip integrity check"
        },
        "healthchecks_url": {
          "type": "string",
          "format": "uri",
          "description": "Healthchecks.io check URL. Pings <url>/start on start, <url> on success, <url>/fail on failure. Empty disables."
        }
      }
    },
    "profiles": {
      "type": "object",
      "description": "Backup jobs. Each key is a profile name (run one via ./backrest <name>).",
      "propertyNames": { "pattern": "^[a-zA-Z0-9_-]+$" },
      "additionalProperties": { "$ref": "#/$defs/profile" }
    }
  },
  "$defs": {
    "profile": {
      "type": "object",
      "additionalProperties": false,
      "required": ["type", "src"],
      "properties": {
        "enabled": {
          "type": "boolean",
          "description": "When false, the profile is skipped on 'run all' but can still be run explicitly (./backrest <name>). Defaults to true."
        },
        "type": {
          "enum": ["restic", "rsync", "s3", "sqlite"],
          "description": "Backend:\n- restic: incremental deduped snapshots to a restic repo\n- rsync: mirror copy to a local dest (and optionally remote_dest)\n- s3: rclone sync to a cloud bucket (e.g. myremote:bucket/path)\n- sqlite: versioned sqlite3 snapshots of a database to a dest dir"
        },
        "src": {
          "type": "string",
          "minLength": 1,
          "description": "Source path to back up. Supports ${path} placeholders. May be a host:path (remote) reference."
        },
        "repo": {
          "type": "string",
          "minLength": 1,
          "description": "(restic/sqlite only) Path to the restic repository, or a backend URL such as s3:https://s3.eu-central-003.backblazeb2.com/bucket/path, b2:bucket:path, or rclone:remote:path. Local repos are created automatically; remote repos are initialized with restic init. Credentials for remote backends come from env_file (or the process environment)."
        },
        "dest": {
          "type": "string",
          "minLength": 1,
          "description": "(rsync/s3 only) Local destination directory for rsync, or rclone remote path (e.g. myremote:bucket/path) for s3."
        },
        "remote_dest": {
          "type": "string",
          "minLength": 1,
          "description": "(rsync only) Optional second rsync destination, e.g. user@host:/path for off-site copies."
        },
        "require_mount": {
          "type": "string",
          "minLength": 1,
          "description": "Optional path that must be a mount point before the profile runs. If it is not mounted, the profile refuses to run (fails) without touching the source or destination — guards against an rclone sync or restic prune hitting an unmounted directory (a failed mount leaves an empty dir behind). Supports ${path} placeholders."
        },
        "retention": {
          "type": "string",
          "minLength": 1,
          "description": "(restic/sqlite only) restic forget policy string, e.g. \"keep-daily 7 keep-weekly 4\". Defaults to \"keep-last 10\"."
        },
        "exclude": {
          "type": "array",
          "items": { "type": "string" },
          "description": "(restic/rsync/s3) --exclude patterns passed to restic, rsync, or rclone. Skips matching files/dirs."
        },
        "flags": {
          "type": "array",
          "items": { "type": "string" },
          "description": "(s3/restic/sqlite) Extra backend flags. For s3: rclone flags passed to the sync (defaults to [\"--checksum\"] when unset, e.g. [\"--size-only\"]). For restic/sqlite: extra restic flags passed to the backup command, e.g. [\"--limit-upload\", \"8000\"] to throttle the first upload."
        },
        "env_file": {
          "type": "string",
          "minLength": 1,
          "description": "Path to a KEY=VALUE env file applied only to this profile's restic/hook commands (e.g. AWS_ACCESS_KEY_ID, AWS_SECRET_ACCESS_KEY, AWS_DEFAULT_REGION for an S3 or Backblaze B2 repository). Overrides global.env_file. Supports ${path} placeholders and a leading ~; relative paths are resolved against the config file's directory."
        },
        "prehook": {
          "type": "string",
          "minLength": 1,
          "description": "Executable script run before the backup (e.g. database dump, stop container). Must be executable."
        },
        "posthook": {
          "type": "string",
          "minLength": 1,
          "description": "Executable script run after the backup, even on failure (e.g. restart container). Must be executable."
        },
        "check": {
          "enum": ["full", "quick", "never"],
          "description": "Integrity check mode, overrides global.check. See global.check."
        }
      },
      "allOf": [
        {
          "if": { "properties": { "type": { "const": "restic" } } },
          "then": { "required": ["repo"] }
        },
        {
          "if": { "properties": { "type": { "const": "sqlite" } } },
          "then": { "required": ["repo"] }
        },
        {
          "if": { "properties": { "type": { "const": "rsync" } } },
          "then": { "required": ["dest"] }
        },
        {
          "if": { "properties": { "type": { "const": "s3" } } },
          "then": { "required": ["dest"] }
        }
      ]
    }
  }
}
